"No.","Time","Source","Destination","Protocol","Length","Info"
"1","0.000000","192.168.3.13","2.16.197.86","TCP","1414","62958  >  443 [ACK] Seq=1 Ack=1 Win=1020 Len=1360"
"2","0.114009","192.168.3.5","192.168.3.255","UDP","62","2008  >  2008 Len=20"
"3","0.202425","192.168.3.13","172.217.30.35","TCP","54","62951  >  443 [FIN, ACK] Seq=1 Ack=1 Win=254 Len=0"
"4","0.218823","192.168.3.13","20.44.10.123","TCP","54","62953  >  443 [FIN, ACK] Seq=1 Ack=1 Win=254 Len=0"
"5","0.232215","172.217.30.35","192.168.3.13","TCP","54","443  >  62951 [FIN, ACK] Seq=1 Ack=2 Win=1043 Len=0"
"6","0.232332","192.168.3.13","172.217.30.35","TCP","54","62951  >  443 [ACK] Seq=2 Ack=2 Win=254 Len=0"
"7","0.367358","124.184.102.254","192.168.3.13","BT-DHT","145","Find_node Target=1747850b0000222e00000f7d0000152a000025d3"
"8","0.367967","192.168.3.13","124.184.102.254","BT-DHT","341","Response Nodes=8"
"9","0.386978","20.44.10.123","192.168.3.13","TCP","54","443  >  62953 [FIN, ACK] Seq=1 Ack=2 Win=16386 Len=0"
"10","0.387067","192.168.3.13","20.44.10.123","TCP","54","62953  >  443 [ACK] Seq=2 Ack=2 Win=254 Len=0"
"11","1.138043","192.168.3.5","192.168.3.255","UDP","62","2008  >  2008 Len=20"
"12","1.203821","192.168.3.13","2.16.197.86","TCP","1414","[TCP Retransmission] 62958  >  443 [ACK] Seq=1 Ack=1 Win=1020 Len=1360"
"13","3.395651","192.168.3.13","82.36.218.226","BT-DHT","146","Get_peers Info_hash=17478517af8f8498d1b6f9e5277fb15ac4921a5b"
"14","3.604473","192.168.3.13","2.16.197.86","TCP","1414","[TCP Retransmission] 62958  >  443 [ACK] Seq=1 Ack=1 Win=1020 Len=1360"
"15","3.711369","2.16.197.86","192.168.3.13","TCP","54","[TCP ACKed unseen segment] 443  >  62958 [ACK] Seq=1 Ack=13848 Win=1007 Len=0"
"16","3.714738","2.16.197.86","192.168.3.13","TLSv1.2","89","Application Data"
"17","3.714828","192.168.3.13","2.16.197.86","TCP","54","[TCP Previous segment not captured] 62958  >  443 [ACK] Seq=13848 Ack=36 Win=1020 Len=0"
"18","3.849484","2.16.197.86","192.168.3.13","TLSv1.2","472","Application Data"
"19","3.849484","2.16.197.86","192.168.3.13","TLSv1.2","473","Application Data"
"20","3.849627","192.168.3.13","2.16.197.86","TCP","54","62958  >  443 [ACK] Seq=13848 Ack=873 Win=1024 Len=0"
"21","3.850608","2.16.197.86","192.168.3.13","TLSv1.2","85","Application Data"
"22","3.850730","192.168.3.13","2.16.197.86","TCP","54","62958  >  443 [ACK] Seq=13848 Ack=904 Win=1023 Len=0"
"23","3.862021","2.16.197.86","192.168.3.13","TLSv1.2","85","Application Data"
"24","3.862093","192.168.3.13","2.16.197.86","TCP","54","62958  >  443 [ACK] Seq=13848 Ack=935 Win=1023 Len=0"
"25","3.905317","192.168.3.13","2.16.197.86","TCP","1414","62958  >  443 [ACK] Seq=13848 Ack=935 Win=1023 Len=1360 [TCP PDU reassembled in 26]"
"26","3.905317","192.168.3.13","2.16.197.86","TLSv1.2","1398","Application Data"
"27","3.905528","192.168.3.13","2.16.197.86","TCP","1414","62958  >  443 [ACK] Seq=16552 Ack=935 Win=1023 Len=1360 [TCP PDU reassembled in 41]"
"28","3.913782","2.16.197.86","192.168.3.13","TCP","66","[TCP Dup ACK 15#1] 443  >  62958 [ACK] Seq=935 Ack=13848 Win=1030 Len=0 SLE=16552 SRE=17912"
"29","3.913843","192.168.3.13","2.16.197.86","TCP","1414","62958  >  443 [ACK] Seq=17912 Ack=935 Win=1023 Len=1360 [TCP PDU reassembled in 41]"
"30","3.922735","2.16.197.86","192.168.3.13","TCP","66","443  >  62958 [ACK] Seq=935 Ack=15208 Win=1053 Len=0 SLE=16552 SRE=17912"
"31","3.922735","2.16.197.86","192.168.3.13","TCP","54","443  >  62958 [ACK] Seq=935 Ack=17912 Win=1076 Len=0"
"32","3.922801","192.168.3.13","2.16.197.86","TCP","1414","62958  >  443 [ACK] Seq=19272 Ack=935 Win=1023 Len=1360 [TCP PDU reassembled in 41]"
"33","3.922801","192.168.3.13","2.16.197.86","TCP","1414","62958  >  443 [ACK] Seq=20632 Ack=935 Win=1023 Len=1360 [TCP PDU reassembled in 41]"
"34","3.938282","2.16.197.86","192.168.3.13","TCP","54","443  >  62958 [ACK] Seq=935 Ack=20632 Win=1121 Len=0"
"35","3.938322","192.168.3.13","2.16.197.86","TCP","1414","62958  >  443 [ACK] Seq=21992 Ack=935 Win=1023 Len=1360 [TCP PDU reassembled in 41]"
"36","3.938322","192.168.3.13","2.16.197.86","TCP","1414","62958  >  443 [ACK] Seq=23352 Ack=935 Win=1023 Len=1360 [TCP PDU reassembled in 41]"
"37","3.938322","192.168.3.13","2.16.197.86","TCP","1414","62958  >  443 [ACK] Seq=24712 Ack=935 Win=1023 Len=1360 [TCP PDU reassembled in 41]"
"38","3.942484","2.16.197.86","192.168.3.13","TLSv1.2","472","Application Data"
"39","3.942565","192.168.3.13","2.16.197.86","TCP","1414","62958  >  443 [ACK] Seq=26072 Ack=1353 Win=1022 Len=1360 [TCP PDU reassembled in 41]"
"40","3.944681","2.16.197.86","192.168.3.13","TCP","54","443  >  62958 [ACK] Seq=1353 Ack=24712 Win=1190 Len=0"
"41","3.944728","192.168.3.13","2.16.197.86","TLSv1.2","1414","Application Data, Application Data"
"42","3.944728","192.168.3.13","2.16.197.86","TCP","1414","62958  >  443 [ACK] Seq=28792 Ack=1353 Win=1022 Len=1360 [TCP PDU reassembled in 45]"
"43","3.972318","2.16.197.86","192.168.3.13","TCP","54","443  >  62958 [ACK] Seq=1353 Ack=27432 Win=1236 Len=0"
"44","3.972318","2.16.197.86","192.168.3.13","TCP","54","443  >  62958 [ACK] Seq=1353 Ack=30152 Win=1281 Len=0"
"45","3.972378","192.168.3.13","2.16.197.86","TLSv1.2","1414","Application Data"
"46","3.972378","192.168.3.13","2.16.197.86","TLSv1.2","143","Application Data, Application Data"
"47","3.973358","2.16.197.86","192.168.3.13","TLSv1.2","85","Application Data"
"48","3.973399","192.168.3.13","2.16.197.86","TCP","54","62958  >  443 [ACK] Seq=31601 Ack=1384 Win=1022 Len=0"
"49","3.978569","2.16.197.86","192.168.3.13","TCP","54","443  >  62958 [ACK] Seq=1384 Ack=31601 Win=1304 Len=0"
"50","4.106350","192.168.3.5","192.168.3.255","UDP","62","2008  >  2008 Len=20"
"51","4.112954","2.16.197.86","192.168.3.13","TLSv1.2","473","Application Data"
"52","4.112954","2.16.197.86","192.168.3.13","TLSv1.2","85","Application Data"
"53","4.113087","192.168.3.13","2.16.197.86","TCP","54","62958  >  443 [ACK] Seq=31601 Ack=1834 Win=1020 Len=0"
"54","4.119891","2.16.197.86","192.168.3.13","TLSv1.2","473","Application Data"
"55","4.119891","2.16.197.86","192.168.3.13","TLSv1.2","85","Application Data"
"56","4.119981","192.168.3.13","2.16.197.86","TCP","54","62958  >  443 [ACK] Seq=31601 Ack=2284 Win=1024 Len=0"
"57","4.247614","64.233.190.188","192.168.3.13","TLSv1.2","383","Application Data"
"58","4.288082","192.168.3.13","64.233.190.188","TCP","54","62356  >  5228 [ACK] Seq=1 Ack=330 Win=253 Len=0"
"59","4.508595","192.168.3.13","200.192.100.13","TCP","66","62982  >  53 [SYN] Seq=0 Win=65535 Len=0 MSS=1460 WS=256 SACK_PERM"
"60","4.508760","192.168.3.13","200.192.100.13","TCP","66","62983  >  53 [SYN] Seq=0 Win=65535 Len=0 MSS=1460 WS=256 SACK_PERM"
"61","4.516372","200.192.100.13","192.168.3.13","TCP","66","53  >  62982 [SYN, ACK] Seq=0 Ack=1 Win=64660 Len=0 MSS=1220 SACK_PERM WS=128"
"62","4.516473","192.168.3.13","200.192.100.13","TCP","54","62982  >  53 [ACK] Seq=1 Ack=1 Win=65280 Len=0"
"63","4.516629","192.168.3.13","200.192.100.13","TCP","56","62982  >  53 [PSH, ACK] Seq=1 Ack=1 Win=65280 Len=2 [TCP PDU reassembled in 64]"
"64","4.516681","192.168.3.13","200.192.100.13","DNS","91","Standard query 0x000d A clients4.google.com"
"65","4.551647","200.192.100.13","192.168.3.13","TCP","66","53  >  62983 [SYN, ACK] Seq=0 Ack=1 Win=64660 Len=0 MSS=1220 SACK_PERM WS=128"
"66","4.551761","192.168.3.13","200.192.100.13","TCP","54","62983  >  53 [ACK] Seq=1 Ack=1 Win=65280 Len=0"
"67","4.551958","192.168.3.13","200.192.100.13","TCP","56","62983  >  53 [PSH, ACK] Seq=1 Ack=1 Win=65280 Len=2 [TCP PDU reassembled in 68]"
"68","4.552021","192.168.3.13","200.192.100.13","DNS","91","Standard query 0x1420 HTTPS clients4.google.com"
"69","4.558262","200.192.100.13","192.168.3.13","TCP","54","53  >  62982 [ACK] Seq=1 Ack=3 Win=64768 Len=0"
"70","4.560427","200.192.100.13","192.168.3.13","TCP","54","53  >  62982 [ACK] Seq=1 Ack=40 Win=64768 Len=0"
"71","4.560427","200.192.100.13","192.168.3.13","DNS","143","Standard query response 0x000d A clients4.google.com CNAME clients.l.google.com A 142.251.129.14"
"72","4.560669","192.168.3.13","200.192.100.13","TCP","54","62982  >  53 [FIN, ACK] Seq=40 Ack=90 Win=65280 Len=0"
"73","4.565891","200.192.100.13","192.168.3.13","TCP","54","53  >  62983 [ACK] Seq=1 Ack=3 Win=64768 Len=0"
"74","4.565891","200.192.100.13","192.168.3.13","TCP","54","53  >  62983 [ACK] Seq=1 Ack=40 Win=64768 Len=0"
"75","4.566659","200.192.100.13","192.168.3.13","TCP","54","53  >  62982 [FIN, ACK] Seq=90 Ack=41 Win=64768 Len=0"
"76","4.566659","200.192.100.13","192.168.3.13","DNS","177","Standard query response 0x1420 HTTPS clients4.google.com CNAME clients.l.google.com SOA ns1.google.com"
"77","4.566701","192.168.3.13","200.192.100.13","TCP","54","62982  >  53 [ACK] Seq=41 Ack=91 Win=65280 Len=0"
"78","4.567452","192.168.3.13","142.251.129.14","TCP","66","62984  >  443 [SYN] Seq=0 Win=65535 Len=0 MSS=1460 WS=256 SACK_PERM"
"79","4.567524","192.168.3.13","200.192.100.13","TCP","54","62983  >  53 [FIN, ACK] Seq=40 Ack=124 Win=65280 Len=0"
"80","4.575590","200.192.100.13","192.168.3.13","TCP","54","53  >  62983 [FIN, ACK] Seq=124 Ack=41 Win=64768 Len=0"
"81","4.575661","192.168.3.13","200.192.100.13","TCP","54","62983  >  53 [ACK] Seq=41 Ack=125 Win=65280 Len=0"
"82","4.581353","142.251.129.14","192.168.3.13","TCP","66","443  >  62984 [SYN, ACK] Seq=0 Ack=1 Win=65535 Len=0 MSS=1360 SACK_PERM WS=256"
"83","4.581438","192.168.3.13","142.251.129.14","TCP","54","62984  >  443 [ACK] Seq=1 Ack=1 Win=65280 Len=0"
"84","4.582177","192.168.3.13","142.251.129.14","TCP","1414","62984  >  443 [ACK] Seq=1 Ack=1 Win=65280 Len=1360 [TCP PDU reassembled in 85]"
"85","4.582177","192.168.3.13","142.251.129.14","TLSv1.3","882","Client Hello (SNI=clients4.google.com)"
"86","4.617231","192.168.3.13","142.251.129.14","TCP","1414","[TCP Retransmission] 62984  >  443 [PSH, ACK] Seq=829 Ack=1 Win=65280 Len=1360 [TCP PDU reassembled in 85]"
"87","4.633270","142.251.129.14","192.168.3.13","TCP","66","[TCP Dup ACK 82#1] 443  >  62984 [ACK] Seq=1 Ack=1 Win=269824 Len=0 SLE=1361 SRE=2189"
"88","4.633325","192.168.3.13","142.251.129.14","TCP","1414","[TCP Retransmission] 62984  >  443 [ACK] Seq=1 Ack=1 Win=65280 Len=1360"
"89","4.726694","HuaweiDevice_af:a2:95","Broadcast","ARP","42","Who has 192.168.3.18? Tell 192.168.3.1"
"90","4.805921","142.251.129.14","192.168.3.13","TCP","74","[TCP Dup ACK 82#2] 443  >  62984 [ACK] Seq=1 Ack=1 Win=269824 Len=0 SLE=1361 SRE=2189 SLE=829 SRE=2189"
"91","4.805971","192.168.3.13","142.251.129.14","TCP","882","[TCP Fast Retransmission] 62984  >  443 [ACK] Seq=1 Ack=1 Win=65280 Len=828"
"92","4.829354","208.103.161.1","192.168.3.13","TLSv1.2","78","Application Data"
"93","4.829863","192.168.3.13","208.103.161.1","TLSv1.2","82","Application Data"
"94","5.014227","208.103.161.1","192.168.3.13","TCP","54","443  >  49760 [ACK] Seq=25 Ack=29 Win=10 Len=0"
"95","5.118555","192.168.3.13","142.251.129.14","TCP","1414","[TCP Retransmission] 62984  >  443 [ACK] Seq=1 Ack=1 Win=65280 Len=1360"
"96","5.728609","192.168.3.13","142.251.129.14","TCP","1414","[TCP Retransmission] 62984  >  443 [ACK] Seq=1 Ack=1 Win=65280 Len=1360"
"97","5.744610","HuaweiDevice_af:a2:95","Broadcast","ARP","42","Who has 192.168.3.18? Tell 192.168.3.1"
"98","6.154522","192.168.3.5","192.168.3.255","UDP","62","2008  >  2008 Len=20"
"99","6.926104","192.168.3.5","224.0.0.251","MDNS","276","Standard query response 0x0000 PTR DESKTOP-MFFHNNL._dosvc._tcp.local SRV 0 0 7680 DESKTOP-MFFHNNL.local TXT"
"100","6.926104","fe80::f0a:8524:541d:f410","ff02::fb","MDNS","296","Standard query response 0x0000 PTR DESKTOP-MFFHNNL._dosvc._tcp.local SRV 0 0 7680 DESKTOP-MFFHNNL.local TXT"
"101","6.926452","192.168.3.5","224.0.0.251","MDNS","93","Standard query 0x0000 ANY DESKTOP-MFFHNNL._dosvc._tcp.local, ""QM"" question"
"102","6.926452","fe80::f0a:8524:541d:f410","ff02::fb","MDNS","113","Standard query 0x0000 ANY DESKTOP-MFFHNNL._dosvc._tcp.local, ""QM"" question"
"103","6.934070","192.168.3.13","142.251.129.14","TCP","1414","[TCP Retransmission] 62984  >  443 [ACK] Seq=1 Ack=1 Win=65280 Len=1360"
"104","7.031555","142.251.129.14","192.168.3.13","TCP","66","443  >  62984 [ACK] Seq=1 Ack=2189 Win=267776 Len=0 SLE=829 SRE=1361"
"105","7.082514","142.251.129.14","192.168.3.13","TLSv1.3","1466","Server Hello, Change Cipher Spec"
"106","7.093677","142.251.129.14","192.168.3.13","TLSv1.3","110","Application Data"
"107","7.093796","192.168.3.13","142.251.129.14","TCP","54","62984  >  443 [ACK] Seq=2189 Ack=1469 Win=65280 Len=0"
"108","7.094270","192.168.3.13","142.251.129.14","TLSv1.3","128","Change Cipher Spec, Application Data"
"109","7.094477","192.168.3.13","142.251.129.14","TLSv1.3","146","Application Data"
"110","7.094659","192.168.3.13","142.251.129.14","TLSv1.3","818","Application Data"
"111","7.094706","192.168.3.13","142.251.129.14","TLSv1.3","1350","Application Data"
"112","7.107531","142.251.129.14","192.168.3.13","TCP","110","[TCP Spurious Retransmission] 443  >  62984 [PSH, ACK] Seq=1413 Ack=2189 Win=267776 Len=56 [TCP PDU reassembled in 106]"
"113","7.107600","192.168.3.13","142.251.129.14","TCP","66","[TCP Dup ACK 107#1] 62984  >  443 [ACK] Seq=4415 Ack=1469 Win=65280 Len=0 SLE=1413 SRE=1469"
"114","7.152308","142.251.129.14","192.168.3.13","TCP","54","443  >  62984 [ACK] Seq=1469 Ack=2263 Win=267776 Len=0"
"115","7.154088","142.251.129.14","192.168.3.13","TLSv1.3","1022","Application Data, Application Data"
"116","7.154371","192.168.3.13","142.251.129.14","TLSv1.3","85","Application Data"
"117","7.175570","142.251.129.14","192.168.3.13","TLSv1.3","85","Application Data"
"118","7.192044","192.168.3.5","192.168.3.255","UDP","62","2008  >  2008 Len=20"
"119","7.194304","142.251.129.14","192.168.3.13","TCP","54","443  >  62984 [ACK] Seq=2468 Ack=3119 Win=267264 Len=0"
"120","7.194304","192.168.3.5","224.0.0.251","MDNS","93","Standard query 0x0000 ANY DESKTOP-MFFHNNL._dosvc._tcp.local, ""QM"" question"
"121","7.194304","fe80::f0a:8524:541d:f410","ff02::fb","MDNS","113","Standard query 0x0000 ANY DESKTOP-MFFHNNL._dosvc._tcp.local, ""QM"" question"
"122","7.228704","192.168.3.13","142.251.129.14","TCP","54","62984  >  443 [ACK] Seq=4446 Ack=2468 Win=64512 Len=0"
"123","7.230627","142.251.129.14","192.168.3.13","TCP","54","443  >  62984 [ACK] Seq=2468 Ack=4415 Win=265984 Len=0"
"124","7.232606","142.251.129.14","192.168.3.13","TCP","54","443  >  62984 [ACK] Seq=2468 Ack=4446 Win=265984 Len=0"
"125","7.368230","142.251.129.14","192.168.3.13","TLSv1.3","438","Application Data"
"126","7.370739","142.251.129.14","192.168.3.13","TLSv1.3","1466","Application Data"
"127","7.370860","192.168.3.13","142.251.129.14","TCP","54","62984  >  443 [ACK] Seq=4446 Ack=4264 Win=65280 Len=0"
"128","7.371886","142.251.129.14","192.168.3.13","TLSv1.3","330","Application Data"
"129","7.371886","142.251.129.14","192.168.3.13","TLSv1.3","217","Application Data"
"130","7.371886","142.251.129.14","192.168.3.13","TLSv1.3","85","Application Data"
"131","7.371941","192.168.3.13","142.251.129.14","TCP","54","62984  >  443 [ACK] Seq=4446 Ack=4734 Win=65024 Len=0"
"132","7.372466","142.251.129.14","192.168.3.13","TLSv1.3","93","Application Data"
"133","7.372494","192.168.3.13","142.251.129.14","TCP","54","62984  >  443 [ACK] Seq=4446 Ack=4773 Win=65024 Len=0"
"134","7.373072","192.168.3.13","142.251.129.14","TLSv1.3","93","Application Data"
"135","7.385962","142.251.129.14","192.168.3.13","TCP","54","443  >  62984 [ACK] Seq=4773 Ack=4485 Win=265984 Len=0"
"136","7.454683","192.168.3.5","224.0.0.251","MDNS","93","Standard query 0x0000 ANY DESKTOP-MFFHNNL._dosvc._tcp.local, ""QM"" question"
"137","7.454683","fe80::f0a:8524:541d:f410","ff02::fb","MDNS","113","Standard query 0x0000 ANY DESKTOP-MFFHNNL._dosvc._tcp.local, ""QM"" question"
"138","7.719454","192.168.3.5","224.0.0.251","MDNS","341","Standard query response 0x0000 PTR, cache flush DESKTOP-MFFHNNL._dosvc._tcp.local SRV, cache flush 0 0 7680 DESKTOP-MFFHNNL.local TXT, cache flush A, cache flush 192.168.3.5 AAAA, cache flush fe80::f0a:8524:541d:f410"
"139","7.719824","fe80::f0a:8524:541d:f410","ff02::fb","MDNS","361","Standard query response 0x0000 PTR, cache flush DESKTOP-MFFHNNL._dosvc._tcp.local SRV, cache flush 0 0 7680 DESKTOP-MFFHNNL.local TXT, cache flush A, cache flush 192.168.3.5 AAAA, cache flush fe80::f0a:8524:541d:f410"
"140","7.724171","192.168.3.5","224.0.0.251","MDNS","277","Standard query response 0x0000 SRV, cache flush 0 0 7680 DESKTOP-MFFHNNL.local TXT, cache flush A, cache flush 192.168.3.5 AAAA, cache flush fe80::f0a:8524:541d:f410"
"141","7.724171","fe80::f0a:8524:541d:f410","ff02::fb","MDNS","297","Standard query response 0x0000 SRV, cache flush 0 0 7680 DESKTOP-MFFHNNL.local TXT, cache flush A, cache flush 192.168.3.5 AAAA, cache flush fe80::f0a:8524:541d:f410"
"142","8.202599","192.168.3.5","192.168.3.255","UDP","62","2008  >  2008 Len=20"
"143","8.304542","192.168.3.13","192.168.3.255","BROWSER","243","Host Announcement VIVOBOOK, Workstation, Server, NT Workstation"
"144","8.412083","192.168.3.13","80.98.28.53","BT-DHT","146","Get_peers Info_hash=174785efdde45f645c76f8711d4e5b217fc0c218"
"145","9.226247","192.168.3.5","192.168.3.255","UDP","62","2008  >  2008 Len=20"
"146","10.250560","192.168.3.5","192.168.3.255","UDP","62","2008  >  2008 Len=20"
"147","10.379588","95.84.231.127","192.168.3.13","BT-DHT","204","Announce_peer Info_hash=1747879097a0b308fcbe72866d94ef29c0782b5c"
"148","10.379858","192.168.3.13","95.84.231.127","BT-DHT","119","Response"
"149","11.274363","192.168.3.5","192.168.3.255","UDP","62","2008  >  2008 Len=20"
"150","12.196105","192.168.3.5","192.168.3.255","UDP","62","2008  >  2008 Len=20"
"151","12.238852","192.168.3.13","172.217.30.4","TCP","66","62985  >  443 [SYN] Seq=0 Win=65535 Len=0 MSS=1460 WS=256 SACK_PERM"
"152","12.251386","172.217.30.4","192.168.3.13","TCP","66","443  >  62985 [SYN, ACK] Seq=0 Ack=1 Win=65535 Len=0 MSS=1360 SACK_PERM WS=256"
"153","12.251576","192.168.3.13","172.217.30.4","TCP","54","62985  >  443 [ACK] Seq=1 Ack=1 Win=65280 Len=0"
"154","12.252317","192.168.3.13","172.217.30.4","TCP","1414","62985  >  443 [ACK] Seq=1 Ack=1 Win=65280 Len=1360 [TCP PDU reassembled in 155]"
"155","12.252317","192.168.3.13","172.217.30.4","TLSv1.3","514","Client Hello (SNI=www.google.com)"
"156","12.268849","192.168.3.13","172.217.30.4","TCP","1414","[TCP Retransmission] 62985  >  443 [PSH, ACK] Seq=461 Ack=1 Win=65280 Len=1360 [TCP PDU reassembled in 155]"
"157","12.559114","172.217.30.4","192.168.3.13","TCP","66","[TCP Retransmission] 443  >  62985 [SYN, ACK] Seq=0 Ack=1 Win=65535 Len=0 MSS=1360 SACK_PERM WS=256"
"158","12.559160","192.168.3.13","172.217.30.4","TCP","66","[TCP Dup ACK 153#1] 62985  >  443 [ACK] Seq=1821 Ack=1 Win=65280 Len=0 SLE=0 SRE=1"
"159","12.574082","192.168.3.13","172.217.30.4","TCP","1414","[TCP Retransmission] 62985  >  443 [ACK] Seq=1 Ack=1 Win=65280 Len=1360"
"160","13.183452","192.168.3.13","172.217.30.4","TCP","1414","[TCP Retransmission] 62985  >  443 [ACK] Seq=1 Ack=1 Win=65280 Len=1360"
"161","13.393444","172.217.30.4","192.168.3.13","TCP","66","[TCP Dup ACK 152#1] 443  >  62985 [ACK] Seq=1 Ack=1 Win=269824 Len=0 SLE=1361 SRE=1821"
"162","13.414180","192.168.3.13","142.4.216.143","BT-DHT","146","Get_peers Info_hash=1747852596f8acdd167bdecbe1e3430e7941036c"
"163","13.818526","172.217.30.4","192.168.3.13","TCP","54","443  >  62985 [ACK] Seq=1 Ack=1821 Win=268032 Len=0"
"164","13.818526","172.217.30.4","192.168.3.13","TCP","66","[TCP Dup ACK 163#1] 443  >  62985 [ACK] Seq=1 Ack=1821 Win=268032 Len=0 SLE=1 SRE=1361"
"165","13.868375","172.217.30.4","192.168.3.13","TCP","1197","[TCP Previous segment not captured] 443  >  62985 [PSH, ACK] Seq=4237 Ack=1821 Win=268032 Len=1143"
"166","13.868461","192.168.3.13","172.217.30.4","TCP","66","[TCP Dup ACK 153#2] 62985  >  443 [ACK] Seq=1821 Ack=1 Win=65280 Len=0 SLE=4237 SRE=5380"
"167","13.869957","172.217.30.4","192.168.3.13","TLSv1.3","1466","[TCP Fast Retransmission] , Server Hello, Change Cipher Spec"
"168","13.870093","192.168.3.13","172.217.30.4","TCP","66","62985  >  443 [ACK] Seq=1821 Ack=1413 Win=65280 Len=0 SLE=4237 SRE=5380"
"169","13.875848","172.217.30.4","192.168.3.13","TCP","1466","[TCP Out-Of-Order] 443  >  62985 [ACK] Seq=1413 Ack=1821 Win=268032 Len=1412"
"170","13.875940","192.168.3.13","172.217.30.4","TCP","66","62985  >  443 [ACK] Seq=1821 Ack=2825 Win=65280 Len=0 SLE=4237 SRE=5380"
"171","13.880472","172.217.30.4","192.168.3.13","TCP","1466","[TCP Out-Of-Order] 443  >  62985 [ACK] Seq=2825 Ack=1821 Win=268032 Len=1412"
"172","13.880568","192.168.3.13","172.217.30.4","TCP","54","62985  >  443 [ACK] Seq=1821 Ack=5380 Win=65280 Len=0"
"173","13.881218","192.168.3.13","172.217.30.4","TLSv1.3","128","Change Cipher Spec, Application Data"
"174","13.889584","172.217.30.4","192.168.3.13","TCP","1466","[TCP Spurious Retransmission] 443  >  62985 [ACK] Seq=1413 Ack=1821 Win=268032 Len=1412"
"175","13.889668","192.168.3.13","172.217.30.4","TCP","66","[TCP Dup ACK 172#1] 62985  >  443 [ACK] Seq=1895 Ack=5380 Win=65280 Len=0 SLE=1413 SRE=2825"
"176","13.919460","172.217.30.4","192.168.3.13","TCP","1466","[TCP Spurious Retransmission] 443  >  62985 [PSH, ACK] Seq=2825 Ack=1821 Win=268032 Len=1412"
"177","13.919512","192.168.3.13","172.217.30.4","TCP","66","[TCP Dup ACK 172#2] 62985  >  443 [ACK] Seq=1895 Ack=5380 Win=65280 Len=0 SLE=2825 SRE=4237"
"178","13.930923","2.16.197.81","192.168.3.13","TLSv1.2","78","Application Data"
"179","13.931063","192.168.3.13","2.16.197.81","TCP","54","62974  >  443 [ACK] Seq=1 Ack=25 Win=1021 Len=0"
"180","13.932792","2.16.197.81","192.168.3.13","TCP","54","443  >  62974 [FIN, ACK] Seq=25 Ack=1 Win=501 Len=0"
"181","13.932831","192.168.3.13","2.16.197.81","TCP","54","62974  >  443 [ACK] Seq=1 Ack=26 Win=1021 Len=0"
"182","13.932893","192.168.3.13","2.16.197.81","TCP","54","62974  >  443 [FIN, ACK] Seq=1 Ack=26 Win=1021 Len=0"
"183","13.936441","2.16.197.81","192.168.3.13","TLSv1.2","78","Application Data"
"184","13.936489","192.168.3.13","2.16.197.81","TCP","54","62973  >  443 [ACK] Seq=1 Ack=25 Win=1021 Len=0"
"185","13.937094","2.16.197.81","192.168.3.13","TCP","54","443  >  62973 [FIN, ACK] Seq=25 Ack=1 Win=501 Len=0"
"186","13.937134","192.168.3.13","2.16.197.81","TCP","54","62973  >  443 [ACK] Seq=1 Ack=26 Win=1021 Len=0"
"187","13.937187","192.168.3.13","2.16.197.81","TCP","54","62973  >  443 [FIN, ACK] Seq=1 Ack=26 Win=1021 Len=0"
"188","13.937852","2.16.197.81","192.168.3.13","TLSv1.2","78","Application Data"
"189","13.937852","2.16.197.81","192.168.3.13","TCP","54","443  >  62971 [FIN, ACK] Seq=25 Ack=1 Win=502 Len=0"
"190","13.937911","192.168.3.13","2.16.197.81","TCP","54","62971  >  443 [ACK] Seq=1 Ack=26 Win=1021 Len=0"
"191","13.937980","192.168.3.13","2.16.197.81","TCP","54","62971  >  443 [FIN, ACK] Seq=1 Ack=26 Win=1021 Len=0"
"192","13.940598","2.16.197.81","192.168.3.13","TLSv1.2","78","Application Data"
"193","13.940598","2.16.197.81","192.168.3.13","TCP","54","443  >  62969 [FIN, ACK] Seq=25 Ack=1 Win=501 Len=0"
"194","13.940598","172.217.30.4","192.168.3.13","TCP","54","443  >  62985 [ACK] Seq=5380 Ack=1895 Win=268032 Len=0"
"195","13.940663","192.168.3.13","2.16.197.81","TCP","54","62969  >  443 [ACK] Seq=1 Ack=26 Win=1021 Len=0"
"196","13.940702","192.168.3.13","2.16.197.81","TCP","54","62969  >  443 [FIN, ACK] Seq=1 Ack=26 Win=1021 Len=0"
"197","13.941337","2.16.197.81","192.168.3.13","TLSv1.2","78","Application Data"
"198","13.941337","2.16.197.81","192.168.3.13","TCP","54","443  >  62972 [FIN, ACK] Seq=25 Ack=1 Win=502 Len=0"
"199","13.941381","192.168.3.13","2.16.197.81","TCP","54","62972  >  443 [ACK] Seq=1 Ack=26 Win=1021 Len=0"
"200","13.941452","192.168.3.13","2.16.197.81","TCP","54","62972  >  443 [FIN, ACK] Seq=1 Ack=26 Win=1021 Len=0"
"201","13.942103","2.16.197.81","192.168.3.13","TCP","54","[TCP Retransmission] 443  >  62974 [FIN, ACK] Seq=25 Ack=1 Win=501 Len=0"
"202","13.942122","192.168.3.13","2.16.197.81","TCP","54","[TCP Dup ACK 181#1] 62974  >  443 [ACK] Seq=2 Ack=26 Win=1021 Len=0"
"203","13.943073","142.4.216.143","192.168.3.13","BT-DHT","109","Response Nodes=0"
"204","13.948599","2.16.197.81","192.168.3.13","TCP","54","[TCP Retransmission] 443  >  62973 [FIN, ACK] Seq=25 Ack=1 Win=501 Len=0"
"205","13.948599","2.16.197.81","192.168.3.13","TCP","54","[TCP Retransmission] 443  >  62971 [FIN, ACK] Seq=25 Ack=1 Win=502 Len=0"
"206","13.948637","192.168.3.13","2.16.197.81","TCP","54","[TCP Dup ACK 186#1] 62973  >  443 [ACK] Seq=2 Ack=26 Win=1021 Len=0"
"207","13.948675","192.168.3.13","2.16.197.81","TCP","54","[TCP Dup ACK 190#1] 62971  >  443 [ACK] Seq=2 Ack=26 Win=1021 Len=0"
"208","13.951854","2.16.197.81","192.168.3.13","TCP","54","[TCP Retransmission] 443  >  62969 [FIN, ACK] Seq=25 Ack=1 Win=501 Len=0"
"209","13.951900","192.168.3.13","2.16.197.81","TCP","54","[TCP Dup ACK 195#1] 62969  >  443 [ACK] Seq=2 Ack=26 Win=1021 Len=0"
"210","13.964425","2.16.197.81","192.168.3.13","TCP","54","[TCP Retransmission] 443  >  62972 [FIN, ACK] Seq=25 Ack=1 Win=502 Len=0"
"211","13.964467","192.168.3.13","2.16.197.81","TCP","54","[TCP Dup ACK 199#1] 62972  >  443 [ACK] Seq=2 Ack=26 Win=1021 Len=0"
"212","13.980015","2.16.197.81","192.168.3.13","TCP","54","443  >  62974 [ACK] Seq=26 Ack=2 Win=501 Len=0"
"213","13.993759","2.16.197.81","192.168.3.13","TCP","54","443  >  62973 [ACK] Seq=26 Ack=2 Win=501 Len=0"
"214","14.004665","2.16.197.81","192.168.3.13","TCP","54","443  >  62971 [ACK] Seq=26 Ack=2 Win=502 Len=0"
"215","14.011691","2.16.197.81","192.168.3.13","TCP","54","443  >  62969 [ACK] Seq=26 Ack=2 Win=501 Len=0"
"216","14.011691","2.16.197.81","192.168.3.13","TCP","54","443  >  62972 [ACK] Seq=26 Ack=2 Win=502 Len=0"
"217","14.021840","2.16.197.81","192.168.3.13","TCP","54","443  >  62971 [RST] Seq=26 Win=0 Len=0"
"218","14.243878","HuaweiDevice_af:a2:95","Broadcast","ARP","60","Who has 192.168.3.9? Tell 192.168.3.1"
"219","14.245430","192.168.3.5","192.168.3.255","UDP","62","2008  >  2008 Len=20"
"220","15.273720","192.168.3.5","192.168.3.255","UDP","62","2008  >  2008 Len=20"
"221","16.293146","192.168.3.5","192.168.3.255","UDP","62","2008  >  2008 Len=20"
"222","16.779581","188.94.33.129","192.168.3.13","BT-DHT","145","Find_node Target=17006feb00005bef000048550000081300005b76"
"223","16.780149","192.168.3.13","188.94.33.129","BT-DHT","341","Response Nodes=8"
"224","17.725963","192.168.3.5","192.168.3.255","UDP","86","57621  >  57621 Len=44"
"225","17.978983","192.168.3.13","142.250.219.227","TCP","66","62986  >  443 [SYN] Seq=0 Win=65535 Len=0 MSS=1460 WS=256 SACK_PERM"
"226","17.990175","142.250.219.227","192.168.3.13","TCP","66","443  >  62986 [SYN, ACK] Seq=0 Ack=1 Win=65535 Len=0 MSS=1360 SACK_PERM WS=256"
"227","17.990283","192.168.3.13","142.250.219.227","TCP","54","62986  >  443 [ACK] Seq=1 Ack=1 Win=65280 Len=0"
"228","17.990859","192.168.3.13","142.250.219.227","TCP","1414","62986  >  443 [ACK] Seq=1 Ack=1 Win=65280 Len=1360 [TCP PDU reassembled in 229]"
"229","17.990859","192.168.3.13","142.250.219.227","TLSv1.3","906","Client Hello (SNI=ssl.gstatic.com)"
"230","18.023242","192.168.3.13","142.250.219.227","TCP","1414","[TCP Retransmission] 62986  >  443 [PSH, ACK] Seq=853 Ack=1 Win=65280 Len=1360 [TCP PDU reassembled in 229]"
"231","18.133026","142.250.219.227","192.168.3.13","TCP","66","[TCP Dup ACK 226#1] 443  >  62986 [ACK] Seq=1 Ack=1 Win=269824 Len=0 SLE=1361 SRE=2213"
"232","18.133076","192.168.3.13","142.250.219.227","TCP","1414","[TCP Retransmission] 62986  >  443 [ACK] Seq=1 Ack=1 Win=65280 Len=1360"
"233","18.260964","142.250.219.227","192.168.3.13","TCP","54","443  >  62986 [ACK] Seq=1 Ack=2213 Win=267776 Len=0"
"234","18.313339","142.250.219.227","192.168.3.13","TLSv1.3","1466","Server Hello, Change Cipher Spec"
"235","18.313339","142.250.219.227","192.168.3.13","TLSv1.3","106","Application Data"
"236","18.313502","192.168.3.13","142.250.219.227","TCP","54","62986  >  443 [ACK] Seq=2213 Ack=1465 Win=65280 Len=0"
"237","18.314245","192.168.3.13","142.250.219.227","TLSv1.3","128","Change Cipher Spec, Application Data"
"238","18.314615","192.168.3.13","142.250.219.227","TLSv1.3","146","Application Data"
"239","18.314807","192.168.3.13","142.250.219.227","TLSv1.3","580","Application Data"
"240","18.343171","142.250.219.227","192.168.3.13","TCP","106","[TCP Spurious Retransmission] 443  >  62986 [PSH, ACK] Seq=1413 Ack=2213 Win=267776 Len=52 [TCP PDU reassembled in 235]"
"241","18.343171","142.250.219.227","192.168.3.13","TCP","54","443  >  62986 [ACK] Seq=1465 Ack=2287 Win=267776 Len=0"
"242","18.343236","192.168.3.13","142.250.219.227","TCP","66","[TCP Dup ACK 236#1] 62986  >  443 [ACK] Seq=2905 Ack=1465 Win=65280 Len=0 SLE=1413 SRE=1465"
"243","18.344520","142.250.219.227","192.168.3.13","TLSv1.3","1014","Application Data, Application Data"
"244","18.344520","142.250.219.227","192.168.3.13","TLSv1.3","85","Application Data"
"245","18.344600","192.168.3.13","142.250.219.227","TCP","54","62986  >  443 [ACK] Seq=2905 Ack=2456 Win=64512 Len=0"
"246","18.344831","192.168.3.13","142.250.219.227","TLSv1.3","85","Application Data"
"247","18.398379","142.250.219.227","192.168.3.13","TCP","66","[TCP Dup ACK 244#1] 443  >  62986 [ACK] Seq=2456 Ack=2379 Win=267776 Len=0 SLE=2905 SRE=2936"
"248","18.398430","192.168.3.13","142.250.219.227","TCP","611","[TCP Retransmission] 62986  >  443 [PSH, ACK] Seq=2379 Ack=2456 Win=64512 Len=557"
"249","18.409793","142.250.219.227","192.168.3.13","TCP","66","443  >  62986 [ACK] Seq=2456 Ack=2936 Win=267264 Len=0 SLE=2905 SRE=2936"
"250","18.426426","192.168.3.13","54.194.135.233","BT-DHT","146","Get_peers Info_hash=1747857b10b62f8e5c95be0336c8185c17e03da1"
"251","18.468597","142.250.219.227","192.168.3.13","TLSv1.3","579","Application Data"
"252","18.468597","142.250.219.227","192.168.3.13","TLSv1.3","128","Application Data"
"253","18.468690","192.168.3.13","142.250.219.227","TCP","54","62986  >  443 [ACK] Seq=2936 Ack=3055 Win=65280 Len=0"
"254","18.470012","142.250.219.227","192.168.3.13","TLSv1.3","85","Application Data"
"255","18.470012","142.250.219.227","192.168.3.13","TLSv1.3","93","Application Data"
"256","18.470044","192.168.3.13","142.250.219.227","TCP","54","62986  >  443 [ACK] Seq=2936 Ack=3125 Win=65280 Len=0"
"257","18.470382","192.168.3.13","142.250.219.227","TLSv1.3","93","Application Data"
"258","18.484693","142.250.219.227","192.168.3.13","TCP","54","443  >  62986 [ACK] Seq=3125 Ack=2975 Win=267264 Len=0"
"259","18.743898","192.168.3.13","185.125.190.57","NTP","90","NTP Version 4, client"
"260","18.934997","185.125.190.57","192.168.3.13","NTP","90","NTP Version 4, server"
"261","19.261473","192.168.3.5","192.168.3.255","UDP","62","2008  >  2008 Len=20"
"262","19.696140","192.214.130.99","192.168.3.13","BT-DHT","145","Find_node Target=174799a19fd875cd5a6f66d0d0ef8d222227d357"
"263","19.696567","192.168.3.13","192.214.130.99","BT-DHT","341","Response Nodes=8"
"264","20.632421","192.168.3.5","192.168.3.13","TCP","66","53343  >  7680 [SYN] Seq=0 Win=65535 Len=0 MSS=1460 WS=256 SACK_PERM"
"265","20.632608","192.168.3.13","192.168.3.5","TCP","66","7680  >  53343 [SYN, ACK] Seq=0 Ack=1 Win=65535 Len=0 MSS=1460 WS=256 SACK_PERM"
"266","20.636305","192.168.3.5","192.168.3.13","TCP","60","53343  >  7680 [ACK] Seq=1 Ack=1 Win=65280 Len=0"
"267","20.636305","192.168.3.5","192.168.3.13","MS-DO","129","Handshake Message (Request)"
"268","20.636745","192.168.3.13","192.168.3.5","MS-DO","129","Handshake Message (Reply)"
"269","20.640472","192.168.3.5","192.168.3.13","MS-DO","69","BitField Message (has 24 of 80 pieces)"
"270","20.640566","192.168.3.13","192.168.3.5","MS-DO","69","BitField Message (has 19 of 80 pieces)"
"271","20.640785","192.168.3.13","192.168.3.5","TCP","54","7680  >  53343 [FIN, ACK] Seq=91 Ack=91 Win=65280 Len=0"
"272","20.644314","192.168.3.5","192.168.3.13","TCP","60","53343  >  7680 [ACK] Seq=91 Ack=92 Win=65280 Len=0"
"273","20.644314","192.168.3.5","192.168.3.13","TCP","60","53343  >  7680 [FIN, ACK] Seq=91 Ack=92 Win=65280 Len=0"
"274","20.644393","192.168.3.13","192.168.3.5","TCP","54","7680  >  53343 [ACK] Seq=92 Ack=92 Win=65280 Len=0"
"275","21.309493","192.168.3.5","192.168.3.255","UDP","62","2008  >  2008 Len=20"
"276","22.333368","192.168.3.5","192.168.3.255","UDP","62","2008  >  2008 Len=20"
"277","22.357764","192.168.3.13","200.192.100.13","DNS","82","Standard query 0xde37 A download.todesktop.com"
"278","22.357985","192.168.3.13","200.192.100.13","DNS","82","Standard query 0x004f HTTPS download.todesktop.com"
"279","22.363082","200.192.100.13","192.168.3.13","DNS","169","Standard query response 0xde37 A download.todesktop.com CNAME download.todesktop.com.cdn.cloudflare.net A 104.18.13.243 A 104.18.12.243"
"280","22.363082","200.192.100.13","192.168.3.13","DNS","207","Standard query response 0x004f HTTPS download.todesktop.com CNAME download.todesktop.com.cdn.cloudflare.net HTTPS"
"281","22.363977","192.168.3.13","104.18.13.243","TCP","66","62987  >  443 [SYN] Seq=0 Win=65535 Len=0 MSS=1460 WS=256 SACK_PERM"
"282","22.484269","104.18.13.243","192.168.3.13","TCP","66","443  >  62987 [SYN, ACK] Seq=0 Ack=1 Win=65535 Len=0 MSS=1360 SACK_PERM WS=8192"
"283","22.484448","192.168.3.13","104.18.13.243","TCP","54","62987  >  443 [ACK] Seq=1 Ack=1 Win=65280 Len=0"
"284","22.485305","192.168.3.13","104.18.13.243","TCP","1414","62987  >  443 [ACK] Seq=1 Ack=1 Win=65280 Len=1360 [TCP PDU reassembled in 285]"
"285","22.485305","192.168.3.13","104.18.13.243","TLSv1.3","665","Client Hello (SNI=download.todesktop.com)"
"286","22.604754","104.18.13.243","192.168.3.13","TCP","54","443  >  62987 [ACK] Seq=1 Ack=1361 Win=65536 Len=0"
"287","22.604754","104.18.13.243","192.168.3.13","TCP","54","443  >  62987 [ACK] Seq=1 Ack=1972 Win=65536 Len=0"
"288","22.611597","104.18.13.243","192.168.3.13","TLSv1.3","1429","Server Hello, Change Cipher Spec, Application Data"
"289","22.612467","192.168.3.13","104.18.13.243","TLSv1.3","118","Change Cipher Spec, Application Data"
"290","22.612715","192.168.3.13","104.18.13.243","TLSv1.3","146","Application Data"
"291","22.612948","192.168.3.13","104.18.13.243","TLSv1.3","299","Application Data"
"292","22.703473","172.217.30.4","192.168.3.13","TCP","54","443  >  62985 [FIN, ACK] Seq=5380 Ack=1895 Win=268032 Len=0"
"293","22.703599","192.168.3.13","172.217.30.4","TCP","54","62985  >  443 [ACK] Seq=1895 Ack=5381 Win=65280 Len=0"
"294","22.731933","104.18.13.243","192.168.3.13","TCP","54","443  >  62987 [ACK] Seq=1376 Ack=2373 Win=65536 Len=0"
"295","22.733390","104.18.13.243","192.168.3.13","TLSv1.3","575","Application Data, Application Data"
"296","22.733974","192.168.3.13","104.18.13.243","TLSv1.3","85","Application Data"
"297","22.895060","104.18.13.243","192.168.3.13","TCP","54","443  >  62987 [ACK] Seq=1897 Ack=2404 Win=65536 Len=0"
"298","23.023497","104.18.13.243","192.168.3.13","TLSv1.3","505","[TCP Previous segment not captured] , Application Data"
"299","23.023497","104.18.13.243","192.168.3.13","TLSv1.3","85","Application Data"
"300","23.023497","104.18.13.243","192.168.3.13","TCP","284","[TCP Out-Of-Order] 443  >  62987 [PSH, ACK] Seq=1897 Ack=2404 Win=65536 Len=230"
"301","23.023552","192.168.3.13","104.18.13.243","TCP","66","[TCP Dup ACK 296#1] 62987  >  443 [ACK] Seq=2404 Ack=1897 Win=64768 Len=0 SLE=2127 SRE=2578"
"302","23.023601","192.168.3.13","104.18.13.243","TCP","66","[TCP Dup ACK 296#2] 62987  >  443 [ACK] Seq=2404 Ack=1897 Win=64768 Len=0 SLE=2127 SRE=2609"
"303","23.023654","192.168.3.13","104.18.13.243","TCP","54","62987  >  443 [ACK] Seq=2404 Ack=2609 Win=64256 Len=0"
"304","23.294816","192.168.3.13","2.16.197.86","TCP","1414","62958  >  443 [ACK] Seq=31601 Ack=2284 Win=1024 Len=1360 [TCP PDU reassembled in 305]"
"305","23.294816","192.168.3.13","2.16.197.86","TLSv1.2","1339","Application Data"
"306","23.294961","192.168.3.13","2.16.197.86","TCP","1414","62958  >  443 [ACK] Seq=34246 Ack=2284 Win=1024 Len=1360 [TCP PDU reassembled in 307]"
"307","23.294961","192.168.3.13","2.16.197.86","TLSv1.2","95","Application Data"
"308","23.295128","192.168.3.13","2.16.197.86","TLSv1.2","85","Application Data"
"309","23.331448","2.16.197.86","192.168.3.13","TCP","54","443  >  62958 [ACK] Seq=2284 Ack=34246 Win=1350 Len=0"
"310","23.331448","2.16.197.86","192.168.3.13","TCP","54","443  >  62958 [ACK] Seq=2284 Ack=35647 Win=1372 Len=0"
"311","23.358265","192.168.3.5","192.168.3.255","UDP","62","2008  >  2008 Len=20"
"312","23.375392","2.16.197.86","192.168.3.13","TCP","54","443  >  62958 [ACK] Seq=2284 Ack=35678 Win=1372 Len=0"
"313","23.431938","192.168.3.13","18.221.7.72","BT-DHT","146","Get_peers Info_hash=17478548bb26c25f922143b3096e0b3445c6fe44"
"314","23.474996","2.16.197.86","192.168.3.13","TLSv1.2","474","Application Data"
"315","23.474996","2.16.197.86","192.168.3.13","TLSv1.2","85","Application Data"
"316","23.475151","192.168.3.13","2.16.197.86","TCP","54","62958  >  443 [ACK] Seq=35678 Ack=2735 Win=1022 Len=0"
"317","23.593564","2.16.197.86","192.168.3.13","TCP","85","[TCP Spurious Retransmission] 443  >  62958 [PSH, ACK] Seq=2704 Ack=35678 Win=1372 Len=31"
"318","23.593630","192.168.3.13","2.16.197.86","TCP","66","[TCP Dup ACK 316#1] 62958  >  443 [ACK] Seq=35678 Ack=2735 Win=1022 Len=0 SLE=2704 SRE=2735"
"319","24.381433","192.168.3.5","192.168.3.255","UDP","62","2008  >  2008 Len=20"
"320","24.502820","18.221.7.72","192.168.3.13","BT-DHT","118","Response Nodes=0"
"321","25.405542","192.168.3.5","192.168.3.255","UDP","62","2008  >  2008 Len=20"
"322","26.429496","192.168.3.5","192.168.3.255","UDP","62","2008  >  2008 Len=20"
"323","27.351728","192.168.3.5","192.168.3.255","UDP","62","2008  >  2008 Len=20"
"324","28.151848","192.168.3.13","200.192.100.13","DNS","82","Standard query 0xbff5 A calendar-api.notion.so"
"325","28.152091","192.168.3.13","200.192.100.13","DNS","82","Standard query 0x2873 HTTPS calendar-api.notion.so"
"326","28.153475","192.168.3.13","200.192.100.13","DNS","78","Standard query 0xf710 A calendar.notion.so"
"327","28.153735","192.168.3.13","200.192.100.13","DNS","78","Standard query 0x24ac HTTPS calendar.notion.so"
"328","28.156567","200.192.100.13","192.168.3.13","DNS","155","Standard query response 0x2873 HTTPS calendar-api.notion.so HTTPS"
"329","28.157631","200.192.100.13","192.168.3.13","DNS","114","Standard query response 0xbff5 A calendar-api.notion.so A 208.103.161.1 A 208.103.161.2"
"330","28.158398","192.168.3.13","208.103.161.1","QUIC","1292","Initial, DCID=f6d26c9d8c5c5bae, PKN: 1, CRYPTO"
"331","28.158465","192.168.3.13","208.103.161.1","QUIC","1292","Initial, DCID=f6d26c9d8c5c5bae, PKN: 2, CRYPTO, PING, PADDING, PING, CRYPTO, PADDING, CRYPTO, PADDING, PING, CRYPTO, PING, PING, PING, PADDING, PING, PING, PADDING, PING"
"332","28.171334","208.103.161.1","192.168.3.13","QUIC","1242","Initial, SCID=011189b8a4cd30ab811061b8d3cd2ccbdf00e2f4, PKN: 0, ACK"
"333","28.171334","208.103.161.1","192.168.3.13","QUIC","1242","Initial, SCID=011189b8a4cd30ab811061b8d3cd2ccbdf00e2f4, PKN: 1, ACK"
"334","28.173182","208.103.161.1","192.168.3.13","QUIC","1242","Initial, SCID=011189b8a4cd30ab811061b8d3cd2ccbdf00e2f4, PKN: 2, CRYPTO"
"335","28.173182","208.103.161.1","192.168.3.13","QUIC","1242","Handshake, SCID=011189b8a4cd30ab811061b8d3cd2ccbdf00e2f4"
"336","28.173755","192.168.3.13","208.103.161.1","QUIC","1292","Protected Payload (KP0), DCID=011189b8a4cd30ab811061b8d3cd2ccbdf00e2f4"
"337","28.174049","192.168.3.13","208.103.161.1","QUIC","556","Protected Payload (KP0), DCID=011189b8a4cd30ab811061b8d3cd2ccbdf00e2f4"
"338","28.174223","192.168.3.13","208.103.161.1","QUIC","547","Protected Payload (KP0), DCID=011189b8a4cd30ab811061b8d3cd2ccbdf00e2f4"
